### ISSUE TITLE
Problem connecting to the drozer Server

### ISSUE THREAD

**Issue by w0lfcat** [FSecureLABS/drozer#401]
I've just installed drozer via docker

```
host-machine:~$ docker run -it --privileged -v /dev/bus/usb:/dev/bus/usb abstractj/drozer bash
* daemon not running. starting it now on port 5037 *
* daemon started successfully *
error: no devices/emulators found
drozer@docker:~$ 
```

https://hub.docker.com/r/abstractj/drozer/

According to this page, all I need to do is install and run drozer

```
drozer@docker:~$ drozer
There was a problem connecting to the drozer Server.

Things to check:

 - is the drozer Server running?
 - have you set up appropriate adb port forwards?
 - have you specified the correct hostname and port with --server?
 - is the server protected with SSL (add an --ssl switch)?
 - is the agent protected with a password (add a --password switch)?

Debug Information:
[Errno 111] Connection refused

drozer@docker:~$ 
```

Drozer in docker container ip is 172.17.0.2

```
drozer@docker:~$ ip r
default via 172.17.0.1 dev eth0 
172.17.0.0/16 dev eth0  proto kernel  scope link  src 172.17.0.2 
drozer@docker:~$ 
```

I've verified that Drozer agent on Genymotion Android emulator has been [turned on](https://i.imgur.com/u06mkxu.png) and listening to port 31415 now

```
host-machine:~$ adb shell netstat -an | grep 31415
tcp6       0      0 :::31415               :::*                   LISTEN
host-machine:~$ 
```

Since connection was refused, I ran tcpdump to troubleshoot issue and found that no traffic to port tcp/31415 received by Android emulator

```
host-machine:~$ adb shell tcpdump -nni any port 31415
tcpdump: verbose output suppressed, use -v or -vv for full protocol decode
listening on any, link-type LINUX_SLL (Linux cooked), capture size 65535 bytes
```

I've googled more and found the following arguments to specify the Drozer Server/Agent IP Address

```
drozer@docker:~$ drozer connect --server 192.168.57.105
There was a problem connecting to the drozer Server.

Things to check:

 - is the drozer Server running?
 - have you set up appropriate adb port forwards?
 - have you specified the correct hostname and port with --server?
 - is the server protected with SSL (add an --ssl switch)?
 - is the agent protected with a password (add a --password switch)?

Debug Information:
timed out

drozer@docker:~$ 
```

It turns out that the Android emulator (192.168.56.105) received the traffic unfortunately drozer client from the docker container (192.168.56.1, the actual docker ip is 172.17.0.2) RESET the connection as shown in the tcpdump output below

```
host-machine:~$ adb shell tcpdump -nni any port 31415
tcpdump: verbose output suppressed, use -v or -vv for full protocol decode
listening on any, link-type LINUX_SLL (Linux cooked), capture size 65535 bytes
00:42:43.574623 IP 192.168.56.1.43690 > 192.168.56.105.31415: Flags [S], seq 2610020757, win 64240, options [mss 1460,sackOK,TS val 3356975240 ecr 0,nop,wscale 7], length 0
00:42:43.574671 IP 192.168.56.105.31415 > 192.168.56.1.43690: Flags [S.], seq 1257353680, ack 2610020758, win 65535, options [mss 1460,sackOK,TS val 106569 ecr 3356975240,nop,wscale 6], length 0
00:42:43.574879 IP 192.168.56.1.43690 > 192.168.56.105.31415: Flags [R], seq 2610020758, win 0, length 0

00:42:59.706318 IP 192.168.56.1.43690 > 192.168.56.105.31415: Flags [S], seq 2610020757, win 64240, options [mss 1460,sackOK,TS val 3356991372 ecr 0,nop,wscale 7], length 0
00:42:59.706421 IP 192.168.56.105.31415 > 192.168.56.1.43690: Flags [S.], seq 1509411940, ack 2610020758, win 65535, options [mss 1460,sackOK,TS val 110602 ecr 3356991372,nop,wscale 6], length 0
00:42:59.706803 IP 192.168.56.1.43690 > 192.168.56.105.31415: Flags [R], seq 2610020758, win 0, length 0

00:43:32.215209 IP 192.168.56.1.43690 > 192.168.56.105.31415: Flags [S], seq 2610020757, win 64240, options [mss 1460,sackOK,TS val 3357023880 ecr 0,nop,wscale 7], length 0
00:43:32.215260 IP 192.168.56.105.31415 > 192.168.56.1.43690: Flags [S.], seq 2017362848, ack 2610020758, win 65535, options [mss 1460,sackOK,TS val 118729 ecr 3357023880,nop,wscale 6], length 0
00:43:32.215547 IP 192.168.56.1.43690 > 192.168.56.105.31415: Flags [R], seq 2610020758, win 0, length 0
```

There were 3 attempts, but all getting reset by 192.168.56.1 (VirtualBox host only ip)

I don't really understand this behavior and I can't make drozer to run because of this. Please help.

**Comment by Yogehi** [comment]
lol not only is drozer no longer in support, but you're gonna ask for help from a docker image we have no association with?

https://github.com/FSecureLABS/drozer/tree/develop/docker

**Comment by NickBot09** [comment]
I am using the docker image at `https://hub.docker.com/r/fsecurelabs/drozer`, but still getting the same error as mentioned above, i.e cannot connect to device using `drozer console connect`

```
drozer@docker:~$ drozer connect --server <my_mobile's_ip>
There was a problem connecting to the drozer Server.

Things to check:

 - is the drozer Server running?
 - have you set up appropriate adb port forwards?
 - have you specified the correct hostname and port with --server?
 - is the server protected with SSL (add an --ssl switch)?
 - is the agent protected with a password (add a --password switch)?

Debug Information:
timed out

drozer@docker:~$ 
```

**Comment by Yogehi** [comment]
Can't give recommendations on what to do if you don't provide information on your setup

* IP address of phone?
* IP address of workstation host?
* can the docker image ping your phone?
* is the drozer server app turned on?
* From your workstation host, while the drozer server is turned on, can you use netcat to connect to the phone's IP address on TCP port 31415?

**Comment by NickBot09** [comment]
Hey my bad, here is some more information on my setup

- I have installed the docker image on my kali linux which is running in VM
- My android device is running on Genymotion on ip `192.168.11.102`
- I can interact with my Android Device from Kali using `adb`
- I have forwarded traffic using `adb forward tcp:31415 tcp:31415`
- My docker's ip is 
```
root@2123bb256c38:/# ip r
default via 172.17.0.1 dev eth0 
172.17.0.0/16 dev eth0  proto kernel  scope link  src 172.17.0.2 
root@2123bb256c38:/# 
```

- The drozer server app is turned on

**Comment by Yogehi** [comment]
If you can interface with your android device via adb, then use adb

adb forward tcp:31415 tcp:31415
docker run -it --add-host host.docker.internal:host-gateway <docker image>
drozer console connect --server host.docker.internal

**Comment by NickBot09** [comment]
It is working now, actually tried it from Kali ( Running in a VM ) but did not work. So I installed docker on my host ( Windows ) and followed the steps, so it is working and I can connect to my Android device via `drozer console connect`. Thanks
